{
  "schemaVersion": "1.0",
  "figure": "cauda-draconis",
  "house": "house-16",
  "summary": "退場、排出與結束的力量進入第十六宮，最終結局傾向離開、放下、清除、分離或完成一個終止。",
  "resonance": {
    "level": "終局共振",
    "score": 96,
    "reason": "龍尾卦本身主退場、流出與結束；第十六宮是結果的結果與最終收束，兩者共同把事件推向終止。"
  },
  "expression": {
    "direct": ["最終離開", "結束", "排出", "分離", "清場"],
    "favorable": ["結束錯誤循環", "完成清理", "放下執著", "解除舊牽連"],
    "neutral": ["退場", "告別", "資源流出", "關係解綁"],
    "shadow": ["耗損", "失去", "被迫分離", "結局崩散", "逃避式結束"]
  },
  "synthesis": {
    "figureNature": "退場、流出、排除、結束舊門檻。",
    "houseField": "結果的結果、最終收束、終局與解脫。",
    "result": "終局本身就是『離開』；關鍵在於這是必要解脫，還是因耗損而失去。"
  },
  "questions": {
    "outcome": {"label": "最終結果", "judgement": "明顯偏向結束、離開或清理，不宜解作穩定維持。", "tone": "caution"},
    "relationship": {"label": "關係", "judgement": "可能是分離、斷開、告別或解除舊牽連；是否為壞事要看原問題是否本就求結束。", "tone": "shadow"},
    "recovery": {"label": "解除與排出", "judgement": "若問題是清除疾病因素、排出毒性、離開困局，方向可能反而有利。", "tone": "good"}
  },
  "specialRole": "在第十六宮，龍尾不只是『正在失去』，而是把退場性提升為整件事的最終收束方式。",
  "notes": ["第十六宮需與第十五宮法官一起看；法官若支持結束，龍尾可讀為完成解脫，若法官反對，則可能是耗損式失去。"],
  "sourceStatus": {"state": "curated-sample", "note": "第一階段代表性專屬落宮條目；供資料結構與顯示驗證。"}
}
