{
  "schemaVersion": "1.0",
  "figure": "albus",
  "house": "house-09",
  "summary": "清明、理解與理性分析的力量進入第九宮，長途、學問、信仰、夢兆與高階知識更容易被說明與整理。",
  "resonance": {
    "level": "高度共振",
    "score": 93,
    "reason": "白色卦主清晰、理解與真相；第九宮主學問、信仰、遠行、夢兆與高階意義，兩者共同強調認知與詮釋。"
  },
  "expression": {
    "direct": ["理解", "說明", "研究", "辨明真相"],
    "favorable": ["學習", "寫作", "宗教研究", "夢境解析", "遠行規劃"],
    "neutral": ["理性化信仰", "知識分類", "尋求證據", "重新詮釋"],
    "shadow": ["過度分析", "只講道理", "把信仰變成冷知識", "忽略直覺"]
  },
  "synthesis": {
    "figureNature": "清晰、理智、觀察、理解與說明。",
    "houseField": "長途旅行、宗教、學問、夢兆、法律與更高意義。",
    "result": "抽象或遠方之事被帶入可理解、可論證、可學習的框架。"
  },
  "questions": {
    "study": {"label": "學習與考試", "judgement": "有利於理解、整理、寫作、研究與找出論證。", "tone": "good"},
    "dream": {"label": "夢兆", "judgement": "夢中訊息較適合被分析與拆解，但不要只靠理性抹去象徵層。", "tone": "good"},
    "travel": {"label": "遠行", "judgement": "利規劃、資訊確認與文件處理；實際成行仍需看第三宮、道路卦與法官。", "tone": "good"}
  },
  "notes": ["第九宮同時涉及信仰與知識；白色卦能提高可理解性，但不保證每個信念本身為真。"],
  "sourceStatus": {"state": "curated-sample", "note": "第一階段代表性專屬落宮條目；供資料結構與顯示驗證。"}
}
