{
  "schemaVersion": "1.0",
  "figure": "rubeus",
  "house": "house-07",
  "summary": "激情、衝突與失控的力量進入第七宮，伴侶、合作方、對手或公開關係成為張力爆發點。",
  "resonance": {
    "level": "高張力共振",
    "score": 90,
    "reason": "紅色卦帶衝突、激情與爆裂；第七宮掌管對手、爭端與公開他者，兩者容易把矛盾推到檯面上。"
  },
  "expression": {
    "direct": ["公開衝突", "激情爆發", "關係破局", "對手升高張力"],
    "favorable": ["揭露隱藏矛盾", "快速切斷有害關係", "正面處理禁忌", "突破僵局"],
    "neutral": ["強烈吸引", "競爭", "高壓談判", "情緒化互動"],
    "shadow": ["暴怒", "報復", "暴力", "失控", "關係互傷"]
  },
  "synthesis": {
    "figureNature": "激情、衝突、爆裂、危險釋放。",
    "houseField": "伴侶、合作、對手、官司與公開互動。",
    "result": "他者關係成為衝突出口；有時能揭露真相，但更常需要控制升級與傷害。"
  },
  "questions": {
    "love": {"label": "感情", "judgement": "強烈但不穩。可能是激情，也可能是爭吵、嫉妒、控制與破局。", "tone": "shadow"},
    "litigation": {"label": "官司與對手", "judgement": "對抗性高，雙方容易升級；需重看第一宮、第十四宮與法官誰更有力。", "tone": "caution"},
    "safety": {"label": "安全", "judgement": "應優先排除暴力、威脅與失控風險，不宜浪漫化高張力。", "tone": "shadow"}
  },
  "notes": ["此組合的『強烈吸引』與『危險衝突』可能並存，不能只取其中一面。"],
  "sourceStatus": {"state": "curated-sample", "note": "第一階段代表性專屬落宮條目；供資料結構與顯示驗證。"}
}
